full_text,processed
Amicus curiae Putusan MK. Pemilu Pilpres Diulang Dan Berganti Pasangan https://t.co/tPIFzOqFZn,amicus curiae putusan pemilu pilpres diulang berganti pasangan
Gibran Rakabuming Raka merespons Timnas AMIN dan TPN Ganjar-Mahfud yang mengajukan gugatan terhadap hasil Pilpres 2024 ke Mahkamah Konstitusi. Salah satu poin gugatan pasangan nomor urut 01 dan 03 adalah pemilu diulang tanpa Prabowo Subianto dan Gibran. Meski begitu putra https://t.co/bT5CVLzqiV,gibran rakabuming raka merespons timnas amin tpn ganjarmahfud mengajukan gugatan hasil pilpres mahkamah konstitusi salah poin gugatan pasangan nomor urut pemilu diulang prabowo subianto gibran putra
Suara Hati Gibran soal Anies-Muhaimin Tuntut Pemilu Ulang: Apa Minta Diulang terus Sampai Menang? https://t.co/LNQBVngZrZ,suara hati-hati gibran aniesmuhaimin tuntut pemilu ulang apa-apa diulang menang
Amicus curiae Putusan MK. Pemilu Pilpres Diulang Dan Berganti Pasangan https://t.co/OsPa5yost3,amicus curiae putusan pemilu pilpres diulang berganti pasangan
Amicus curiae Putusan MK. Pemilu Pilpres Diulang Dan Berganti Pasangan https://t.co/dBzFYcinp6,amicus curiae putusan pemilu pilpres diulang berganti pasangan
Amicus Curiae Putusan MK Pemilu Pilpres Diulang dan Berganti Pasangan https://t.co/Hre1LOr19l https://t.co/A6z0uNO2fp,amicus curiae putusan pemilu pilpres diulang berganti pasangan
Pemilu diulang tanpa gibran SMF diulang tanpa youngj sama juri2nya dah sekalian,pemilu diulang gibran smf diulang youngj jurinya deh
NADZAR diujung Harapan. Amicus curiae Putusan MK. Pemilu Pilpres Diulang Dan Berganti Pasangan https://t.co/UC0O3T4RK9,nadzar diujung harapan amicus curiae putusan pemilu pilpres diulang berganti pasangan
Insyaallah....seluruh hakim MK punya keputusan yang sama dengan hati yang jernih dan pikiran logis menyatakan pemilu diulang tanpa Paslon 02.,insyaallahseluruh hakim keputusan hati-hati jernih pikiran logis pemilu diulang paslon
Megawati Sukarnoputri mengajukan diri sebagai Amicus Curiae atau sahabat pengadilan. Ini tondo tondo tidak baik bagi 02. Kalaupun pemilu diulang dan 02 diikutkan bisa jadi Gibran dianulir. Karena dianggap sebagai anak haram konstitusi. Semoga keputusannya yg terbaik.,megawati sukarnoputri mengajukan amicus curiae sahabat pengadilan tondo tondo tidak pemilu diulang diikutkan gibran dianulir dianggap anak-anak haram konstitusi semoga keputusannya terbaik
PASLON 02 PRABOWO-GIBRAN DAG DIG DUK DOOORRR... PASLON 02 SIAP SIAPLAH UNTUK PEMILU 2 PUTARAN....‼️ #KetuaKPUBerkhianat #KetuaKPUBerkhianat 🆘🆗 https://t.co/Cu6QNww6QX,paslon prabowogibran dag dig duk dooorrr paslon siaplah pemilu putaran
1. MK memutus sengketa pemilu &amp; menjadikan pemilu thn ini 1 putaran diiringi kontroversi yg ada 2. Banyak masyarakat Indonesia yg beriman 1. Allah akan memberikan hasil terbaik untuk hambanya yg beriman 2. Allah memberikan ujian kpd orang beriman sbg bentuk kasih sayang Nya,memutus sengketa pemilu menjadikan pemilu putaran diiringi kontroversi masyarakat indonesia beriman allah hasil terbaik hambanya beriman allah ujian orang-orang beriman bentuk kasih sayang
2019 Prabowo menang di 13 Provinsi dan selisih 9℅ an. Selow aja dan Terima hasil pemilu 2024 ganjar kalah semua provinsi Anies menang cuma 2 provinsi. Selisih kalah 34℅. Sewotx sampe mehong. Padahal Prabowo-Gibran menang di 36 provinsi Berkhayal 2 putaran faktax 2 provinsi,prabowo menang provinsi selisih an selow terima hasil pemilu ganjar kalah provinsi anies menang provinsi selisih kalah sewotx mehong prabowogibran menang provinsi berkhayal putaran faktax provinsi
kalau sdh diumumkan hasil resmi di DKI 01 dan 02 imbang.. besar kemungkinan Pemilu 2 putaran! Kesempatan bagi ke 2 pasangan utk membuktikan siapa yg benar-benar dipilih rakyat di putaran ke 2!,diumumkan hasil resmi dki imbang besar-besar pemilu putaran kesempatan pasangan membuktikan benarbenar dipilih rakyat putaran
kan belum juga lebaran pada ngumpul WA grup kluarga rame dah tanya kapan gue nikah. dan saling kirim foto kenalan nya masing2 suruh aq milih berasa pemilu putaran ke 2 yang mana yg mo gue coblos bangke bner dah ...,belum lebaran ngumpul wa grup keluarga rame deh gue nikah kirim foto-foto kenalan suruh memilih berasa pemilu putaran gue coblos bangkai deh
DAHLAH yuk bisa yuk pemilu 2 putaran. Mayan jadi libur lagi Request tgl 25 keatas deh biar abis gajian,dahlah yuk yuk pemilu putaran lumayan libur request tanggal keatas deh habis gajian
Momen bersejarah di Indo hari ini : Pemilu 2 putaran Penalty 2 putaran #timnasday #indonesia,momen bersejarah indonesia pemilu putaran penalty putaran
@ARSIPAJA Kl seandainya pemilu putaran ke 2 itu dilakasanakan bulan juni,seandainya pemilu putaran dilakasanakan juni
